{
  "contractVersion": "1.0.0",
  "application": {
    "code": "sales-order",
    "name": "Sales Order"
  },
  "command": {
    "code": "approve-sales-order",
    "name": "Approve Sales Order",
    "inputVersion": "1.0.0",
    "requiresConfirmation": true
  },
  "fields": [
    {
      "key": "orderNo",
      "label": "Order No",
      "semanticType": "Text",
      "required": true
    },
    {
      "key": "customer",
      "label": "Customer",
      "semanticType": "CustomerRef",
      "required": true
    },
    {
      "key": "productId",
      "label": "Product",
      "semanticType": "ItemRef",
      "required": true
    },
    {
      "key": "quantity",
      "label": "Quantity",
      "semanticType": "Quantity",
      "required": true,
      "unit": "EA",
      "min": 1
    },
    {
      "key": "unitPrice",
      "label": "Unit Price",
      "semanticType": "Money",
      "required": true,
      "min": 0
    },
    {
      "key": "currency",
      "label": "Currency",
      "semanticType": "Currency",
      "required": true,
      "options": [
        {
          "value": "USD",
          "label": "USD"
        },
        {
          "value": "SGD",
          "label": "SGD"
        }
      ]
    },
    {
      "key": "fulfillmentMode",
      "label": "Fulfillment Mode",
      "semanticType": "Enum",
      "required": true,
      "options": [
        {
          "value": "MAKE",
          "label": "Make"
        },
        {
          "value": "BUY",
          "label": "Buy"
        },
        {
          "value": "STOCK",
          "label": "Stock"
        }
      ]
    }
  ]
}
